{
  "schema": "gs-deep-dive-sync-v1",
  "tenantId": "11111111-1111-4111-8111-111111111111",
  "tenantName": "Test Tenant",
  "generatedAt": "2026-10-25T12:00:00.000Z",
  "items": [
    { "id": "item-1", "type": "deep_dive", "key": "DD-1", "title": "Test Deep Dive", "summary": null, "status": "active",
      "fields": {}, "parentId": null, "updatedAt": "2026-10-25T11:00:00.000Z" }
  ],
  "files": [
    { "id": "file-1", "itemId": "item-1", "title": "Test file", "kind": "pdf", "status": "held", "heldAt": "2026-10-25T11:00:00.000Z" }
  ],
  "documentRequests": [
    { "id": "req-1", "title": "Test request", "note": null, "itemIds": ["item-1"], "status": "open", "receivedAt": null,
      "createdAt": "2026-10-25T10:00:00.000Z" }
  ],
  "deliverables": [
    { "id": "del-1", "title": "Test deliverable", "version": 1, "status": "published", "publishedAt": "2026-10-25T09:00:00.000Z",
      "acceptedAt": null }
  ],
  "findings": [
    { "id": "finding-1", "streamItemId": "item-1", "statement": "Test finding", "status": "validated",
      "evidenceCount": 1, "supersedesId": null, "updatedAt": "2026-10-25T11:00:00.000Z" }
  ],
  "opportunities": [
    { "id": "opportunity-1", "ref": "OP-1", "title": "Test opportunity", "statement": "Test statement",
      "desiredOutcome": "Test outcome", "status": "validated", "findingIds": ["finding-1"],
      "streamItemIds": ["item-1"], "updatedAt": "2026-10-25T11:00:00.000Z" }
  ],
  "kpis": [
    { "id": "kpi-1", "title": "Test KPI", "definition": "Test definition", "scope": "company", "unit": "days",
      "direction": "down", "baseline": 5, "baselinePeriod": "2026-10", "target": 3,
      "opportunityIds": ["opportunity-1"], "updatedAt": "2026-10-25T11:00:00.000Z" }
  ]
}
